{
  "$schema": "./schema.json",
  "version": 1,
  "meta": {
    "title": "多线程",
    "tz": "America/Indiana/Indianapolis",
    "dayStart": "08:00",
    "dayEnd": "24:00",
    "maxParallel": 4,
    "staleAfterDays": 3,
    "maxPushDays": 2,
    "updatedAt": "2026-10-29T14:07:28.947Z"
  },
  "tracks": [
    { "id": "surf-hw", "name": "SURF · 硬件", "color": "#b8692f", "group": "SURF" },
    { "id": "surf-act", "name": "SURF · ACT 实验", "color": "#2f6db8", "group": "SURF" },
    { "id": "surf-bay", "name": "SURF · Bayesian gate", "color": "#1f8f99", "group": "SURF" },
    { "id": "surf-out", "name": "SURF · 联系", "color": "#2f8a5f", "group": "SURF" },
    { "id": "surf-app", "name": "SURF · 申请", "color": "#7a4fb3", "group": "SURF" },
    { "id": "csse416", "name": "课程 · CSSE416 LLM", "color": "#d4a017", "group": "课程" },
    { "id": "csse232", "name": "课程 · CSSE232 Arch", "color": "#db2777", "group": "课程" },
    { "id": "ece551", "name": "课程 · ECE551 VLSI", "color": "#4f46e5", "group": "课程" },
    { "id": "school", "name": "课程 · 校历", "color": "#64748b", "group": "课程" },
    { "id": "merl-arm", "name": "MERL · Robot arm", "color": "#65a30d", "group": "MERL" },
    { "id": "merl-sim", "name": "MERL · Simulation", "color": "#c026d3", "group": "MERL" }
  ],
  "tasks": [
    { "id": "tk-surf-pad", "trackId": "surf-hw", "title": "铜箔 15×8 pad 制作", "start": "2026-10-31", "end": "2026-10-31", "note": "前提：Amazon 的料周五前到" },
    { "id": "tk-surf-fw", "trackId": "surf-hw", "title": "F411 firmware（ADC scan + DMA、USB CDC、双时间戳、热力图）", "start": "2026-10-31", "end": "2026-11-01" },
    { "id": "tk-surf-selftest", "trackId": "surf-hw", "title": "自检：crosstalk、TPU 弯折基线 b(θ)", "start": "2026-11-01", "end": "2026-11-02" },
    { "id": "tk-surf-offfw", "trackId": "surf-hw", "title": "官方 firmware 跑通，作参考基线", "start": "2026-11-06", "end": "2026-11-07" },
    { "id": "tk-surf-flexi", "trackId": "surf-hw", "title": "F411 驱动 FlexiTac 控制板（先核对 3.3V）", "start": "2026-11-07", "end": "2026-11-10" },
    {
      "id": "tk-surf-expdesign",
      "trackId": "surf-act",
      "title": "实验设计：任务、接触真值标定、指标",
      "start": "2026-11-02",
      "end": "2026-11-03",
      "baseline": "2026-10-30",
      "slips": [{ "at": "2026-10-29", "from": "2026-10-30", "to": "2026-11-03", "reason": "用户改到下周，和实验一起排", "by": "user" }],
      "focus": ["2026-11-02", "2026-11-03"]
    },
    {
      "id": "tk-surf-demo",
      "trackId": "surf-act",
      "title": "采 demo（同步录 tactile），训 vision-only ACT baseline",
      "start": "2026-11-04",
      "end": "2026-11-05",
      "note": "铜箔 pad 的 demo 只给 vision-only baseline 和延迟测量用",
      "focus": ["2026-11-04", "2026-11-05"]
    },
    {
      "id": "tk-surf-latency",
      "trackId": "surf-act",
      "title": "阶段 2：rollout 中测接触到推理的延迟",
      "start": "2026-11-06",
      "end": "2026-11-08",
      "focus": ["2026-11-06", "2026-11-07", "2026-11-08"]
    },
    {
      "id": "tk-surf-stage3",
      "trackId": "surf-act",
      "title": "阶段 3：FPC 重采 demo，tactile ACT、soft gate、事件触发重推理",
      "start": "2026-11-16",
      "end": "2027-01-15",
      "note": "估计；不影响发邮件，邮件里写成正在做"
    },
    { "id": "tk-surf-likeli", "trackId": "surf-bay", "title": "采似然标定数据：L0 空夹爪开合，L1 夹物", "start": "2026-11-02", "end": "2026-11-03" },
    { "id": "tk-surf-bayes", "trackId": "surf-bay", "title": "离线拟合 binary Bayes filter，和阈值规则比延迟、误报", "start": "2026-11-04", "end": "2026-11-09" },
    { "id": "tk-surf-pt", "trackId": "surf-bay", "title": "移植到 F411，按 sensor 频率输出 p_t（可选）", "start": "2026-11-10", "end": "2026-11-14", "note": "可选" },
    { "id": "tk-surf-watch", "trackId": "surf-out", "title": "盯 SURF project list", "start": "2026-10-27", "end": "2026-11-10" },
    {
      "id": "tk-surf-heng",
      "trackId": "surf-out",
      "title": "给 Heng Zhang 发技术问题（先确认身份）",
      "start": "2026-11-02",
      "end": "2026-11-06",
      "baseline": "2026-10-31",
      "slips": [{ "at": "2026-10-29", "from": "2026-10-31", "to": "2026-11-06", "reason": "用户推到下周", "by": "user" }],
      "focus": ["2026-11-02"]
    },
    { "id": "tk-surf-draft", "trackId": "surf-out", "title": "起草给 Yu She 的邮件", "start": "2026-11-09", "end": "2026-11-12" },
    { "id": "tk-surf-recs", "trackId": "surf-out", "title": "确定并联系推荐人", "start": "2026-11-09", "end": "2026-11-25", "note": "感恩节那周（11/23 起）教授回复慢" },
    {
      "id": "tk-surf-facpost",
      "trackId": "surf-app",
      "title": "Faculty 发布 project（往年 10 月初到 11 月初）",
      "start": "2026-10-26",
      "end": "2026-11-06",
      "note": "外部窗口，估计"
    },
    { "id": "tk-surf-sop", "trackId": "surf-app", "title": "填申请、Statement of Purpose", "start": "2026-12-01", "end": "2026-12-15" },
    {
      "id": "tk-fall-finals",
      "trackId": "school",
      "title": "Fall 期末考试周",
      "start": "2026-11-16",
      "end": "2026-11-19",
      "hard": true,
      "note": "11/16 8am 到 11/19 5pm"
    },
    {
      "id": "tk-416-final",
      "trackId": "csse416",
      "title": "Final Project（Sprint 1 → 2 → 展示）",
      "start": "2026-10-29",
      "end": "2026-11-13",
      "hard": true,
      "note": "11/13 交 code、slides、reflections"
    },
    { "id": "tk-232-p9", "trackId": "csse232", "title": "Practical9 Pipelined Processor III", "start": "2026-11-06", "end": "2026-11-12" },
    {
      "id": "tk-arm-check",
      "trackId": "merl-arm",
      "title": "确认所有 existing arm working",
      "start": "2026-10-29",
      "end": "2026-10-30",
      "focus": ["2026-10-29", "2026-10-30"]
    },
    { "id": "tk-arm-print", "trackId": "merl-arm", "title": "Print new arm part", "start": "2026-10-29", "end": "2026-11-06" },
    {
      "id": "tk-arm-build",
      "trackId": "merl-arm",
      "title": "Build 5 more arm",
      "start": "2026-10-29",
      "end": "2026-11-06",
      "focus": ["2026-10-29", "2026-10-30", "2026-11-02", "2026-11-03", "2026-11-04", "2026-11-05", "2026-11-06"]
    }
  ],
  "milestones": [
    { "id": "ms-d6gk", "trackId": "surf-hw", "title": "FPC 和控制板到货（估计）", "date": "2026-11-06" },
    { "id": "ms-65su", "trackId": "surf-out", "title": "给 Yu She 发邮件", "date": "2026-11-13" },
    { "id": "ms-k3dq", "trackId": "surf-app", "title": "学生申请开放（往年 12/1，待确认）", "date": "2026-12-01" },
    { "id": "ms-eilq", "trackId": "surf-app", "title": "SURF Priority deadline（travel subsidy）", "date": "2027-01-15", "hard": true },
    { "id": "ms-sbcz", "trackId": "school", "title": "最后退课日（W）", "date": "2026-10-30", "hard": true },
    { "id": "ms-tipo", "trackId": "school", "title": "Fall term 结束 / 秋冬之间放假", "date": "2026-11-23" },
    { "id": "ms-j30v", "trackId": "school", "title": "Winter 开课", "date": "2026-11-30" },
    { "id": "ms-22kz", "trackId": "school", "title": "Winter 选课截止 4pm", "date": "2026-12-02", "hard": true },
    { "id": "ms-8vzi", "trackId": "school", "title": "寒假开始（课后）", "date": "2026-12-18" },
    { "id": "ms-xhji", "trackId": "school", "title": "Winter 复课", "date": "2027-01-04" },
    { "id": "ms-4esk", "trackId": "csse416", "title": "Test 2", "date": "2026-11-03", "hard": true },
    { "id": "ms-8m5x", "trackId": "csse232", "title": "Quiz 4（HW11、HW12）", "date": "2026-10-30", "hard": true },
    { "id": "ms-oh5e", "trackId": "csse232", "title": "Quiz 5（HW15、HW16）", "date": "2026-11-10", "hard": true },
    { "id": "ms-tzp8", "trackId": "ece551", "title": "Quiz 4", "date": "2026-11-02", "hard": true },
    { "id": "ms-1yfe", "trackId": "ece551", "title": "Quiz 5", "date": "2026-11-13", "hard": true },
    { "id": "ms-lup0", "trackId": "merl-sim", "title": "写 tutorial（今晚，约 30 分钟）", "date": "2026-10-29" }
  ],
  "todos": [
    { "id": "td-2nch", "title": "Sprint 1 Status Report（3pm）", "date": "2026-10-29", "trackId": "csse416", "taskId": "tk-416-final" },
    { "id": "td-747s", "title": "Sprint 1 Meeting", "date": "2026-10-30", "trackId": "csse416", "taskId": "tk-416-final" },
    { "id": "td-j1db", "title": "交 Random lesson", "date": "2026-11-02", "trackId": "csse416" },
    { "id": "td-1hyw", "title": "Test 2 复习", "date": "2026-11-02", "trackId": "csse416" },
    { "id": "td-aa6u", "title": "Sprint 2 Status Report（3pm）", "date": "2026-11-05", "trackId": "csse416", "taskId": "tk-416-final" },
    { "id": "td-naxf", "title": "Sprint 2 System Demo + Meeting", "date": "2026-11-06", "trackId": "csse416", "taskId": "tk-416-final" },
    { "id": "td-cju6", "title": "给其他组写 feedback（Moodle，自己不展示的那天）", "date": "2026-11-09", "trackId": "csse416" },
    { "id": "td-se4g", "title": "给其他组写 feedback（Moodle，自己不展示的那天）", "date": "2026-11-10", "trackId": "csse416" },
    { "id": "td-bkp2", "title": "给其他组写 feedback（Moodle，自己不展示的那天）", "date": "2026-11-12", "trackId": "csse416" },
    { "id": "td-9v0h", "title": "给其他组写 feedback（Moodle，自己不展示的那天）", "date": "2026-11-13", "trackId": "csse416" },
    { "id": "td-0rgc", "title": "交 Final Project：code、slides、reflections", "date": "2026-11-13", "trackId": "csse416", "taskId": "tk-416-final" },
    { "id": "td-qzd3", "title": "交 HW15", "date": "2026-10-30", "trackId": "csse232" },
    { "id": "td-72bq", "title": "交 Practical8", "date": "2026-11-05", "trackId": "csse232" },
    { "id": "td-qoaw", "title": "交 HW16", "date": "2026-11-06", "trackId": "csse232" },
    { "id": "td-1sqq", "title": "交 Practical9", "date": "2026-11-12", "trackId": "csse232", "taskId": "tk-232-p9" },
    { "id": "td-nn32", "title": "Wrap up（必须出勤）", "date": "2026-11-13", "trackId": "csse232" },
    { "id": "td-y27f", "title": "CATME pipeline team eval", "date": "2026-11-16", "trackId": "csse232" },
    { "id": "td-ue7m", "title": "Practical 10 Pipeline Design Presentation（期末周，日期待定）", "trackId": "csse232" },
    { "id": "td-9k2h", "title": "交 Hw 7", "date": "2026-10-29", "trackId": "ece551" },
    { "id": "td-drhb", "title": "Project: Proposal", "date": "2026-10-30", "trackId": "ece551" },
    { "id": "td-l1hk", "title": "Proj: Proposal Timing", "date": "2026-11-04", "trackId": "ece551" },
    { "id": "td-zkao", "title": "交 Hw 8", "date": "2026-11-05", "trackId": "ece551" },